<?xml version="1.0" encoding="UTF-8" standalone="yes"?>
<xs:schema version="1.0" targetNamespace="http://www.skyve.org/xml/router" xmlns:ns2="http://www.skyve.org/xml/common" xmlns:ns1="http://www.skyve.org/xml/view" xmlns:tns="http://www.skyve.org/xml/router" xmlns:xs="http://www.w3.org/2001/XMLSchema">

  <xs:import namespace="http://www.skyve.org/xml/view" schemaLocation="view.xsd"/>

  <xs:import namespace="http://www.skyve.org/xml/common" schemaLocation="common.xsd"/>

  <xs:element name="router" type="tns:router"/>

  <xs:complexType name="route">
    <xs:sequence>
      <xs:element name="criteria" type="tns:routeCriteria" form="qualified" minOccurs="0" maxOccurs="unbounded"/>
    </xs:sequence>
    <xs:attribute name="outcome" type="xs:string" use="required"/>
  </xs:complexType>

  <xs:complexType name="routeCriteria">
    <xs:sequence/>
    <xs:attribute name="customer" type="xs:string"/>
    <xs:attribute name="dataGroupId" type="xs:string"/>
    <xs:attribute name="document" type="xs:string"/>
    <xs:attribute name="module" type="xs:string"/>
    <xs:attribute name="query" type="xs:string"/>
    <xs:attribute name="userId" type="xs:string"/>
    <xs:attribute name="viewType" type="ns1:viewType"/>
    <xs:attribute name="webAction" type="ns2:webAction"/>
  </xs:complexType>

  <xs:complexType name="router">
    <xs:sequence>
      <xs:element name="uxui" type="tns:uxUi" form="qualified" maxOccurs="unbounded"/>
    </xs:sequence>
    <xs:attribute name="uxuiSelectorClassName" type="xs:string" use="required"/>
  </xs:complexType>

  <xs:complexType name="uxUi">
    <xs:complexContent>
      <xs:extension base="ns2:namedMetaData">
        <xs:sequence>
          <xs:element name="route" type="tns:route" form="qualified" maxOccurs="unbounded"/>
        </xs:sequence>
      </xs:extension>
    </xs:complexContent>
  </xs:complexType>
</xs:schema>

